{
  "schema_version": 1,
  "id": "system",
  "kind": "module",
  "name": "System Monitor",
  "category": "Monitoring",
  "description": "Легковесная системная телеметрия: CPU по ядрам, RAM, swap, uptime, load и процессы.",
  "publisher": {
    "id": "routerforge",
    "name": "RouterForge",
    "url": "https://github.com/Fifth-Ace/dns-monitor"
  },
  "project_url": "https://github.com/Fifth-Ace/dns-monitor",
  "source": "routerforge-official",
  "managed": true,
  "package_authoritative": true,
  "detection": {
    "packages": [
      "dns-monitor-system"
    ],
    "services": [
      "/opt/etc/init.d/S92dns-monitor-system"
    ]
  },
  "compatibility": {
    "status": "requirements",
    "hints": [
      "RouterForge Core",
      "Entware",
      "Keenetic / Netcraze ARM64"
    ]
  },
  "install": {
    "method": "routerforge-release",
    "repository": "routerforge-dev",
    "repository_url": "https://github.com/Fifth-Ace/dns-monitor/releases/download/routerforge-dev",
    "checksum_url": "https://github.com/Fifth-Ace/dns-monitor/releases/download/routerforge-dev/routerforge-dev-SHA256SUMS",
    "asset_template": "{package}_{version}_aarch64-3.10.ipk",
    "packages": [
      "dns-monitor-system"
    ],
    "notes": [
      "Скачивается только выбранный IPK из GitHub release RouterForge.",
      "SHA256 проверяется до opkg install; временный IPK удаляется после операции."
    ],
    "preview_only": false
  },
  "update": {
    "method": "routerforge-release",
    "repository": "routerforge-dev",
    "repository_url": "https://github.com/Fifth-Ace/dns-monitor/releases/download/routerforge-dev",
    "checksum_url": "https://github.com/Fifth-Ace/dns-monitor/releases/download/routerforge-dev/routerforge-dev-SHA256SUMS",
    "asset_template": "{package}_{version}_aarch64-3.10.ipk",
    "packages": [
      "dns-monitor-system"
    ],
    "notes": [
      "Обновление dev-канала выполняет verified force-reinstall текущего RouterForge build."
    ],
    "preview_only": false
  },
  "remove": {
    "method": "opkg",
    "packages": [
      "dns-monitor-system"
    ],
    "notes": [
      "Удаляется только package; RouterForge Core остаётся независимым."
    ],
    "preview_only": false
  }
}
