{
  "schema_version": 1,
  "id": "profiling",
  "kind": "module",
  "name": "Profiling",
  "category": "Development",
  "description": "Опциональный loopback-only pprof и slow-request logging для RouterForge Core.",
  "publisher": {
    "id": "routerforge",
    "name": "RouterForge",
    "url": "https://github.com/Fifth-Ace/dns-monitor"
  },
  "project_url": "https://github.com/Fifth-Ace/dns-monitor",
  "source": "routerforge-official",
  "managed": true,
  "package_authoritative": true,
  "detection": {
    "packages": [
      "routerforge-profiling",
      "dns-monitor-profiling"
    ],
    "paths": [
      "/opt/etc/routerforge/profiling.enabled",
      "/opt/etc/dns-monitor/profiling.enabled"
    ]
  },
  "compatibility": {
    "status": "requirements",
    "hints": [
      "RouterForge Core",
      "Entware",
      "Keenetic / Netcraze ARM64"
    ]
  },
  "install": {
    "method": "routerforge-release",
    "repository": "routerforge-beta",
    "repository_url": "https://github.com/Fifth-Ace/dns-monitor/releases/download/routerforge-beta",
    "checksum_url": "https://github.com/Fifth-Ace/dns-monitor/releases/download/routerforge-beta/routerforge-beta-SHA256SUMS",
    "asset_template": "{package}_{version}_aarch64-3.10.ipk",
    "packages": [
      "routerforge-profiling"
    ],
    "notes": [
      "Скачивается только выбранный IPK из GitHub release RouterForge.",
      "SHA256 проверяется до opkg install; временный IPK удаляется после операции."
    ],
    "preview_only": false
  },
  "update": {
    "method": "routerforge-release",
    "repository": "routerforge-beta",
    "repository_url": "https://github.com/Fifth-Ace/dns-monitor/releases/download/routerforge-beta",
    "checksum_url": "https://github.com/Fifth-Ace/dns-monitor/releases/download/routerforge-beta/routerforge-beta-SHA256SUMS",
    "asset_template": "{package}_{version}_aarch64-3.10.ipk",
    "packages": [
      "routerforge-profiling"
    ],
    "notes": [
      "Обновление beta-канала мигрирует legacy dns-monitor-* package на RouterForge namespace при необходимости."
    ],
    "preview_only": false
  },
  "remove": {
    "method": "structured",
    "packages": [
      "routerforge-profiling",
      "dns-monitor-profiling"
    ],
    "notes": [
      "Удаляются RouterForge package и legacy-предшественник, если он ещё установлен."
    ],
    "preview_only": false,
    "steps": [
      {
        "type": "opkg-remove",
        "packages": [
          "routerforge-profiling"
        ],
        "ignore_failure": true
      },
      {
        "type": "opkg-remove",
        "packages": [
          "dns-monitor-profiling"
        ],
        "ignore_failure": true
      }
    ]
  },
  "presentation": {
    "dashboard": {
      "enabled": false,
      "priority": 99
    }
  },
  "capabilities": [
    "pprof",
    "slow-request-log"
  ]
}
