{
  "schema_version": 1,
  "id": "network",
  "kind": "module",
  "name": "Network Monitor",
  "category": "Monitoring",
  "description": "Интерфейсы, адреса, RX/TX rates, errors/drops, wireless, routes и conntrack.",
  "publisher": {
    "id": "routerforge",
    "name": "RouterForge",
    "url": "https://github.com/Fifth-Ace/dns-monitor"
  },
  "project_url": "https://github.com/Fifth-Ace/dns-monitor",
  "source": "routerforge-official",
  "managed": true,
  "package_authoritative": true,
  "detection": {
    "packages": [
      "routerforge-network",
      "dns-monitor-network"
    ],
    "services": [
      "/opt/etc/init.d/S95routerforge-network",
      "/opt/etc/init.d/S95dns-monitor-network"
    ]
  },
  "compatibility": {
    "status": "requirements",
    "hints": [
      "RouterForge Core",
      "Entware",
      "Keenetic / Netcraze ARM64"
    ]
  },
  "install": {
    "method": "routerforge-release",
    "repository": "routerforge-beta",
    "repository_url": "https://github.com/Fifth-Ace/dns-monitor/releases/download/routerforge-beta",
    "checksum_url": "https://github.com/Fifth-Ace/dns-monitor/releases/download/routerforge-beta/routerforge-beta-SHA256SUMS",
    "asset_template": "{package}_{version}_aarch64-3.10.ipk",
    "packages": [
      "routerforge-network"
    ],
    "notes": [
      "Скачивается только выбранный IPK из GitHub release RouterForge.",
      "SHA256 проверяется до opkg install; временный IPK удаляется после операции."
    ],
    "preview_only": false
  },
  "update": {
    "method": "routerforge-release",
    "repository": "routerforge-beta",
    "repository_url": "https://github.com/Fifth-Ace/dns-monitor/releases/download/routerforge-beta",
    "checksum_url": "https://github.com/Fifth-Ace/dns-monitor/releases/download/routerforge-beta/routerforge-beta-SHA256SUMS",
    "asset_template": "{package}_{version}_aarch64-3.10.ipk",
    "packages": [
      "routerforge-network"
    ],
    "notes": [
      "Обновление beta-канала мигрирует legacy dns-monitor-* package на RouterForge namespace при необходимости."
    ],
    "preview_only": false
  },
  "remove": {
    "method": "structured",
    "packages": [
      "routerforge-network",
      "dns-monitor-network"
    ],
    "notes": [
      "Удаляются RouterForge package и legacy-предшественник, если он ещё установлен."
    ],
    "preview_only": false,
    "steps": [
      {
        "type": "opkg-remove",
        "packages": [
          "routerforge-network"
        ],
        "ignore_failure": true
      },
      {
        "type": "opkg-remove",
        "packages": [
          "dns-monitor-network"
        ],
        "ignore_failure": true
      }
    ]
  },
  "presentation": {
    "dashboard": {
      "enabled": true,
      "priority": 40
    }
  },
  "process_names": [
    "routerforge-network",
    "dnsmon-network"
  ],
  "capabilities": [
    "interfaces",
    "traffic-rates",
    "errors",
    "wireless",
    "routes",
    "conntrack"
  ]
}
